{
  "$schema": "http://json-schema.org/draft-07/schema#",
  "$id": "https://kingin-yellows.dev/schemas/codex-plugin.schema.json",
  "title": "Codex Plugin Manifest Schema",
  "description": "Schema for the generated plugins/<name>/.codex-plugin/plugin.json \u2014 the Codex-target counterpart to plugins/<name>/.claude-plugin/plugin.json (R6).",
  "$comment": "Repository exposure schema, not an official OpenAI schema. Codex CLI 0.157.0 install/list and app-server skills/list verify the generated skill paths. commands must be [] to suppress compatibility migration of Claude commands. hooks/list verifies registration and untrusted state only; hook execution and authenticated MCP use require separate runtime checks. See docs/runtime-install-smoke.md and docs/research/codex-phase-1-2026-10-05/report.md.",
  "type": "object",
  "additionalProperties": false,
  "required": ["name", "version", "interface", "description", "commands"],
  "properties": {
    "name": {
      "type": "string",
      "pattern": "^[a-z0-9-]+$",
      "minLength": 1,
      "description": "Must match the plugin's directory name and its package.json 'name' (sole version/name authority, R3)."
    },
    "version": {
      "type": "string",
      "pattern": "^[0-9]+\\.[0-9]+\\.[0-9]+$",
      "description": "Sourced from package.json (R6)."
    },
    "interface": {
      "type": "object",
      "additionalProperties": false,
      "required": ["displayName", "category"],
      "properties": {
        "displayName": {
          "type": "string",
          "minLength": 1
        },
        "category": {
          "type": "string",
          "minLength": 1
        },
        "developerName": {
          "type": "string",
          "minLength": 1
        },
        "websiteURL": {
          "type": "string",
          "format": "uri"
        }
      }
    },
    "description": {
      "type": "string",
      "minLength": 1,
      "description": "Target-specific description override from the catalog when present, else the shared description (R6)."
    },
    "commands": {
      "type": "array",
      "maxItems": 0,
      "description": "Repository exposure policy: require an explicit empty list to suppress Codex compatibility migration of Claude commands into extra skills. Verified with codex-cli 0.157.0; see https://github.com/openai/codex/blob/rust-v0.157.0/codex-rs/core-plugins/src/command_migration/plugin.rs. Omission enables commands/ discovery, bypassing the catalog skill allowlist."
    },
    "skills": {
      "type": "string",
      "minLength": 1,
      "pattern": "^(?:\\./)?(?!.*\\.\\.)(?:(?:[A-Za-z0-9_-]+/)*[A-Za-z0-9_-]+/?|(?:[A-Za-z0-9._-]+/)+)$",
      "description": "Manifest-relative path to the normalized Codex skill tree, e.g. './codex/skills' (R7). Directory-path pattern mirrored from schemas/plugin.schema.json's 'relativeDir' definition (no absolute prefixes, no '..' traversal)."
    },
    "hooks": {
      "type": "string",
      "minLength": 1,
      "pattern": "^(?:\\./)?(?!.*\\.\\.)[A-Za-z0-9._/-]+\\.[A-Za-z0-9]+$",
      "description": "Generated local hook config path. Pinned 0.157.0 lifecycle execution is separately tested with exact disposable trust."
    },
    "mcpServers": {
      "oneOf": [
        {
          "type": "string",
          "pattern": "^(?:\\./)(?!.*\\.\\.)[A-Za-z0-9._/-]+\\.json$"
        },
        {
          "type": "object",
          "minProperties": 1,
          "propertyNames": {
            "pattern": "^[a-z][a-z0-9_-]*$"
          },
          "additionalProperties": {
            "type": "object",
            "additionalProperties": false,
            "required": ["url"],
            "properties": {
              "url": {
                "type": "string",
                "pattern": "^https://[^@?#$\\s]+$"
              },
              "enabled_tools": {
                "type": "array",
                "minItems": 1,
                "maxItems": 4,
                "uniqueItems": true,
                "items": {
                  "enum": [
                    "ask_wiki_question",
                    "ask_question",
                    "read_wiki_structure",
                    "read_wiki_contents"
                  ]
                }
              }
            }
          }
        }
      ],
      "description": "Explicit file reference or target-selected public HTTPS URL-only map. No Claude userConfig, headers, credential environment or substitutions."
    },
    "author": {
      "type": "object",
      "additionalProperties": false,
      "required": ["name"],
      "properties": {
        "name": {
          "type": "string",
          "minLength": 1
        },
        "url": {
          "type": "string",
          "format": "uri"
        },
        "email": {
          "type": "string",
          "format": "email"
        }
      },
      "description": "Shared catalog attribution. The legacy 0.157.0 parser ignores this top-level metadata; interface.developerName carries runtime presentation."
    },
    "license": {
      "type": "string",
      "minLength": 1
    },
    "keywords": {
      "type": "array",
      "uniqueItems": true,
      "items": {
        "type": "string",
        "pattern": "^[a-z0-9-]+$"
      }
    }
  }
}
