{
  "name": "yellow-core",
  "version": "2.11.2",
  "author": {
    "name": "KingInYellows",
    "url": "https://github.com/KingInYellows"
  },
  "license": "MIT",
  "keywords": [
    "code-review",
    "research",
    "typescript",
    "python",
    "rust",
    "go"
  ],
  "interface": {
    "displayName": "Yellow Core",
    "category": "Developer Tools",
    "developerName": "KingInYellows",
    "websiteURL": "https://github.com/KingInYellows/yellow-plugins#yellow-core"
  },
  "description": "Four read-only skills: agent-native architecture and audit references, plan-status dashboard, and existing-worktree inventory. Excludes commands, agents, hooks and all other skills.",
  "commands": [],
  "skills": "./codex/skills"
}
