{
  "name": "yellow-cursor",
  "version": "0.3.0",
  "author": {
    "name": "KingInYellows",
    "url": "https://github.com/KingInYellows"
  },
  "license": "MIT",
  "keywords": [
    "cursor",
    "cloud-agents",
    "remote-agent",
    "delegation",
    "ai-agent",
    "automation"
  ],
  "interface": {
    "displayName": "Yellow Cursor",
    "category": "automation",
    "developerName": "KingInYellows",
    "websiteURL": "https://github.com/KingInYellows/yellow-plugins#yellow-cursor"
  },
  "description": "Cursor Cloud Agents integration — delegate coding tasks to Cursor's remote agents, track status, and manage runs",
  "commands": [],
  "skills": "./codex/skills"
}
