{
  "name": "yellow-ci",
  "version": "1.5.8",
  "author": {
    "name": "KingInYellows",
    "url": "https://github.com/KingInYellows"
  },
  "license": "MIT",
  "keywords": [
    "ci",
    "github-actions",
    "self-hosted",
    "runner",
    "diagnosis"
  ],
  "interface": {
    "displayName": "Yellow CI",
    "category": "Developer Tools",
    "developerName": "KingInYellows",
    "websiteURL": "https://github.com/KingInYellows/yellow-plugins#yellow-ci"
  },
  "description": "CI failure diagnosis, GitHub Actions workflow linting, self-hosted runner setup and health skills, invoked as Codex skills. Read-mostly: SSH/config writes and workflow-lint fixes always preview and confirm first.",
  "commands": [],
  "skills": "./codex/skills",
  "hooks": "./hooks/codex-hooks.json"
}
