{
  "name": "yellow-review",
  "version": "3.8.1",
  "author": {
    "name": "KingInYellows",
    "url": "https://github.com/KingInYellows"
  },
  "license": "MIT",
  "keywords": [
    "pr",
    "code-review",
    "graphite"
  ],
  "interface": {
    "displayName": "Yellow Review",
    "category": "Developer Tools",
    "developerName": "KingInYellows",
    "websiteURL": "https://github.com/KingInYellows/yellow-plugins#yellow-review"
  },
  "description": "One read-only skill: the thermonuclear structural-quality review rubric — code-judo restructurings, spaghetti-condition growth, weak type and module boundaries, misplaced ownership, and evidence-gated file-size threshold crossings (when the requester supplies before/after line counts). Invoke it explicitly by name; it is not applied to ordinary reviews automatically. Reports findings only; never edits the repository. Excludes all of yellow-review's commands, agents, and other skills.",
  "commands": [],
  "skills": "./codex/skills"
}
